{
  "format": "wl3pc.block-handler-materials",
  "format_version": 1,
  "evidence_base": {
    "repository": "ElectroDeoxys/warioland3",
    "commit": "560fce6faf50df4a48c0448f00105b6075f8f231",
    "file": "src/engine/level/block_functions.asm",
    "research_note": "docs/02-research/block-handlers.md"
  },
  "materials": {
    "empty": "Every probe gets BlockFunc_Free: a = $00, no position change.",
    "solid": "BlockFunc_Solid: a = $01 and the probe's hYPosLo is snapped to a multiple of $10. Exception: a Wario wall probe (UNK4) while wWarioSlopeInteraction is set returns a = $00.",
    "platform": "BlockFunc_Floor: solid to the standing probes (DOWN, UNK2); solid to the landing probes (UNK1, UNK6) only when hYPosLo & $0f < 5; free to the ceiling, wall, and presence probes.",
    "slope-right": "RightSlopeCollision, rising to the right: DOWN and UNK1 probes only (UNK1 is free when x + y < $10 inside the block); hYPosLo becomes the block top + $10 - x; a = $10.",
    "slope-left": "LeftSlopeCollision, rising to the left: DOWN and UNK1 probes only (UNK1 is free when x >= y inside the block); hYPosLo becomes the block top + x + 2; a = $10.",
    "slope-right-upper": "Block above a right slope: only the DOWN probe collides, against the right slope one block lower.",
    "slope-right-lower": "Block below a right slope: DOWN and UNK1 probes collide against the right slope one block higher; solid to Wario in WST_ATTACKING_AIRBORNE; otherwise free.",
    "slope-left-upper": "Block above a left slope: only the DOWN probe collides, against the left slope one block lower.",
    "slope-left-lower": "Block below a left slope: DOWN and UNK1 probes collide against the left slope one block higher; solid to Wario in WST_ATTACKING_AIRBORNE; otherwise free."
  },
  "flags": {
    "ladder": "Wario's presence probe (UNK7) sets wLadderInteraction = LADDER_COLLISION.",
    "ladder-top": "Wario's presence probe (UNK7) sets wLadderInteraction = LADDER_UNDERNEATH and is free; other Wario probes and all object probes treat the block as a platform.",
    "door": "Wario's presence probe with Up pressed in WST_IDLING, WST_SLIPPING, or WST_GRAB_IDLING sets wRoomTransitionParam to room_transition and runs EnterDoor.",
    "treasure-door": "Any Wario probe with Up pressed, no transformation, in WST_IDLING, WST_SLIPPING, or WST_GRAB_IDLING clears wGrabState and sets wLevelEndScreen = LVLEND_NO_TREASURE. The probe kind is not checked.",
    "room-transition": "Wario's presence probe (UNK7) sets wRoomTransitionParam to room_transition.",
    "zombie-passable": "Free to Wario in WST_ZOMBIE_LANDING or WST_ZOMBIE_SLIPPING_THROUGH_FLOOR.",
    "breakable-cracked": "CrackedBlockCollision: with wBlockFuncBreakFlag set, breaks on a wall probe while attacking or rolling, a ceiling probe with HEAD_SMASH_HELMET or better while jumping or swimming, or a landing probe; replaces the block with replacement_block (keeping bit 7). Robo-mouse special collisions also break or pass it.",
    "breakable-cracked-colour-coin": "CrackedBlockWithColourCoinCollision: as breakable-cracked, without the robo-mouse checks, and calls BreakBlockWithColourCoin.",
    "breakable-non-cracked": "NonCrackedBlockCollision: with wBlockFuncBreakFlag set, needs GARLIC or better (Fat Wario breaks it only with a landing probe); wall probe while attacking or rolling, ceiling probe with HEAD_SMASH_HELMET while jumping or swimming, or landing probe with SUPER_JUMP_SLAM_OVERALLS. Solid afterwards unless rolling.",
    "breakable-by-thrown-object": "EnemyBlockCollision: solid; breaks only when wBlockFuncSpecialCollision is COLLISION_THROWN_OBJ.",
    "breakable-by-hot-wario": "BonfireBlockCollision: solid; breaks for Wario as TRANSFORMATION_HOT_WARIO with wTransformationProgress >= 2."
  },
  "handlers": [
    {"id": "h06_4020", "symbol": "BlockFunc_Free", "material": "empty", "flags": [],
     "evidence": "06:4020: clears wBlockFuncBreakFlag, wBlockFuncSpecialCollision, wUnused_c18d; returns a = $00."},
    {"id": "h06_4032", "symbol": "BlockFunc_Solid", "material": "solid", "flags": [],
     "evidence": "06:4032: clears the flags; Wario + wWarioSlopeInteraction + UNK4 returns a = $00; otherwise hYPosLo &= $f0 and a = $01."},
    {"id": "h06_4208", "symbol": "BlockFunc_Floor", "material": "platform", "flags": ["zombie-passable"],
     "evidence": "06:4208: sets wc1ca; DOWN or UNK2 -> solid; UNK3/4/5/7 -> free; otherwise (UNK1, UNK6) solid if hYPosLo & $0f < 5; zombie states free for Wario."},
    {"id": "h06_40d9", "symbol": "BlockFunc_RightSlope", "material": "slope-right", "flags": [],
     "evidence": "06:40d9: DOWN|UNK1 only; UNK1 free when x + y < $10; RightSlopeCollision sets hYPosLo = top + $10 - x, ON_SLOPE | RIGHT_SLOPE; Func_18064 returns a = $10."},
    {"id": "h06_4163", "symbol": "BlockFunc_LeftSlope", "material": "slope-left", "flags": [],
     "evidence": "06:4163: DOWN|UNK1 only; UNK1 free when x >= y; LeftSlopeCollision sets hYPosLo = top + x + 2, ON_SLOPE | LEFT_SLOPE; returns a = $10."},
    {"id": "h06_409f", "symbol": "BlockFunc_1809f", "material": "slope-right-upper", "flags": [],
     "evidence": "06:409f: DOWN only; hYPos += $10, then RightSlopeCollision."},
    {"id": "h06_40b5", "symbol": "BlockFunc_180b5", "material": "slope-right-lower", "flags": [],
     "evidence": "06:40b5: Wario in WST_ATTACKING_AIRBORNE -> BlockFunc_Solid; DOWN|UNK1: hYPos -= $10, then RightSlopeCollision; otherwise free."},
    {"id": "h06_4129", "symbol": "BlockFunc_18129", "material": "slope-left-upper", "flags": [],
     "evidence": "06:4129: DOWN only; hYPos += $10, then LeftSlopeCollision."},
    {"id": "h06_413f", "symbol": "BlockFunc_1813f", "material": "slope-left-lower", "flags": [],
     "evidence": "06:413f: Wario in WST_ATTACKING_AIRBORNE -> BlockFunc_Solid; DOWN|UNK1: hYPos -= $10, then LeftSlopeCollision; otherwise free."},
    {"id": "h06_42c3", "symbol": "BlockFunc_Ladder", "material": "empty", "flags": ["ladder"],
     "evidence": "06:42c3: objects free; Wario UNK7 sets LADDER_COLLISION and returns via Func_1808c (a = $00); otherwise free."},
    {"id": "h06_42e5", "symbol": "BlockFunc_LadderTop", "material": "platform", "flags": ["ladder-top"],
     "evidence": "06:42e5: objects -> BlockFunc_Floor; Wario UNK7 sets LADDER_UNDERNEATH (a = $00); other Wario probes -> BlockFunc_Floor."},
    {"id": "h06_42fe", "symbol": "BlockFunc_182fe", "material": "empty", "flags": ["ladder", "room-transition"],
     "room_transition": 69,
     "evidence": "06:42fe: Wario UNK7 sets LADDER_COLLISION and wRoomTransitionParam = ROOMTRANSITION_5 | ROOMTRANSITIONF_RELOAD_OBJECTS ($45); always free."},
    {"id": "h06_45cb", "symbol": "BlockFunc_Door", "material": "empty", "flags": ["door"],
     "room_transition": 226,
     "evidence": "06:45cb: Wario UNK7 + Up pressed + idle/slipping/grab-idle -> wRoomTransitionParam = ROOMTRANSITION_DOOR | DOOR | RELOAD_OBJECTS | DELAY ($e2), EnterDoor; always free."},
    {"id": "h06_477e", "symbol": "BlockFunc_TreasureDoor", "material": "empty", "flags": ["treasure-door"],
     "evidence": "06:477e: Wario + Up pressed + no transformation + idle/slipping/grab-idle -> wGrabState = 0, wLevelEndScreen = LVLEND_NO_TREASURE; always free; wCollisionPoints is not read."},
    {"id": "h06_47b0", "symbol": "BlockFunc_187b0", "material": "empty", "flags": ["room-transition"],
     "room_transition": 68,
     "evidence": "06:47b0: Wario UNK7 sets wRoomTransitionParam = ROOMTRANSITION_4 | ROOMTRANSITIONF_RELOAD_OBJECTS ($44); always free."},
    {"id": "h06_49fb", "symbol": "BlockFunc_CrackedBlockWithColourCoin_78", "material": "solid",
     "flags": ["breakable-cracked-colour-coin"], "replacement_block": 120,
     "evidence": "06:49fb: b = $78, CrackedBlockWithColourCoinCollision."},
    {"id": "h06_4a13", "symbol": "BlockFunc_CrackedBlockWithColourCoin_7e", "material": "solid",
     "flags": ["breakable-cracked-colour-coin"], "replacement_block": 126,
     "evidence": "06:4a13: b = $7e, CrackedBlockWithColourCoinCollision."},
    {"id": "h06_4cb4", "symbol": "BlockFunc_CrackedBlock_78", "material": "solid", "flags": ["breakable-cracked"],
     "replacement_block": 120, "evidence": "06:4cb4: b = $78, CrackedBlockCollision."},
    {"id": "h06_4cb8", "symbol": "BlockFunc_CrackedBlock_79", "material": "solid", "flags": ["breakable-cracked"],
     "replacement_block": 121, "evidence": "06:4cb8: b = $79, CrackedBlockCollision."},
    {"id": "h06_4cbc", "symbol": "BlockFunc_CrackedBlock_7a", "material": "solid", "flags": ["breakable-cracked"],
     "replacement_block": 122, "evidence": "06:4cbc: b = $7a, CrackedBlockCollision."},
    {"id": "h06_4cc0", "symbol": "BlockFunc_CrackedBlock_7b", "material": "solid", "flags": ["breakable-cracked"],
     "replacement_block": 123, "evidence": "06:4cc0: b = $7b, CrackedBlockCollision."},
    {"id": "h06_4cc4", "symbol": "BlockFunc_CrackedBlock_7c", "material": "solid", "flags": ["breakable-cracked"],
     "replacement_block": 124, "evidence": "06:4cc4: b = $7c, CrackedBlockCollision."},
    {"id": "h06_4cc8", "symbol": "BlockFunc_CrackedBlock_7d", "material": "solid", "flags": ["breakable-cracked"],
     "replacement_block": 125, "evidence": "06:4cc8: b = $7d, CrackedBlockCollision."},
    {"id": "h06_4ccc", "symbol": "BlockFunc_CrackedBlock_7e", "material": "solid", "flags": ["breakable-cracked"],
     "replacement_block": 126, "evidence": "06:4ccc: b = $7e, CrackedBlockCollision."},
    {"id": "h06_4d60", "symbol": "BlockFunc_NonCrackedBlock_78", "material": "solid", "flags": ["breakable-non-cracked"],
     "replacement_block": 120, "evidence": "06:4d60: b = $78, NonCrackedBlockCollision."},
    {"id": "h06_4d6c", "symbol": "BlockFunc_NonCrackedBlock_7b", "material": "solid", "flags": ["breakable-non-cracked"],
     "replacement_block": 123, "evidence": "06:4d6c: b = $7b, NonCrackedBlockCollision."},
    {"id": "h06_4d70", "symbol": "BlockFunc_NonCrackedBlock_7c", "material": "solid", "flags": ["breakable-non-cracked"],